{
  "schemaVersion": 1,
  "cycleId": "CYCLE-072",
  "executedAt": "2026-09-02T02:02:00+08:00",
  "taskIds": [
    "TASK-0199"
  ],
  "checks": [
    {
      "name": "模块列表、详情、表单与权限交互回归",
      "command": "cd projects/unexamine/frontend; npm test -- --run (30 files / 87 tests)",
      "result": "passed"
    },
    {
      "name": "运行主链类型检查与生产构建",
      "command": "cd projects/unexamine/frontend; npm run build (3943 modules)",
      "result": "passed"
    },
    {
      "name": "客户列表主任务、详情信息组织与桌面溢出验收",
      "command": "Browser QA at /systems/44?workspace=runtime&module=customer_c68_227384",
      "result": "passed"
    },
    {
      "name": "跟进记录引用字段业务名称选择验收",
      "command": "Browser QA: 跟进记录 -> 新建跟进记录 -> 关联客户",
      "result": "passed"
    },
    {
      "name": "模块页产品语言、内部 ID 与主动作门禁",
      "command": "Browser DOM audit: one page primary action, no version tags/cycle markers/raw IDs, no page overflow",
      "result": "passed"
    }
  ],
  "journeys": []
}
